63,Data Governance & Metadata,"Quản lý metadata, lineage, data quality, consent, audit log, policy version, owner và kiểm soát dữ liệu. Domain này bảo đảm A-score có thể giải thích, truy vết, kiểm toán, xử lý missing đúng chuẩn và tuân thủ quy định bảo vệ dữ liệu; đa số thuộc tính là control/monitoring chứ không phải feature mô hình.",ConsentRecord,Ghi nhận đồng ý xử lý dữ liệu cá nhân.,"consent_id, party_id, consent_type, consent_status, granted_at, revoked_at",Requested → Granted → Revoked/Expired,party_grants_consent: Party cấp consent ConsentRecord
64,,,DataAsset,Bảng/file/API/feature table được quản trị.,"data_asset_id, asset_name, asset_type, owner, sensitivity_level, status",Registered → Certified → Deprecated → Retired,data_asset_checked_by: DataAsset được kiểm tra bởi DataQualityCheck
65,,,DataQualityCheck,"Kiểm tra chất lượng dữ liệu: null, duplicate, format, range, freshness.","dq_check_id, data_asset_id, rule_name, result, score, checked_at",Scheduled → Executed → Passed/Failed,data_asset_checked_by: DataAsset được kiểm tra bởi DataQualityCheck
66,,,AuditLog,Nhật ký thay đổi quan trọng trên object/rule/score/decision.,"audit_id, object_type, object_id, action, actor, timestamp, before_value, aft...",Created → Stored → Archived,object_audited_by: AnyObject được audit bởi AuditLog
67,System Integration & API,"Quản lý API contract, request/response, inference log, feature snapshot, replay package, fallback/rollback và integration với LOS/Decision Engine/partner. Domain này giúp vận hành scoring ổn định ở runtime, kiểm soát lỗi, routing, SLA và khả năng replay; phần lớn thuộc tính là monitoring/audit/routing.",ExternalSystem,"Hệ thống ngoài: CIC, eKYC provider, payment gateway, bảo hiểm, đối tác.","system_id, system_name, system_type, owner, status",Registered → Active → Suspended → Retired,external_system_has_api: ExternalSystem cung cấp API APIEndpoint
68,,,APIEndpoint,API endpoint dùng để tích hợp dữ liệu/nghiệp vụ.,"endpoint_id, system_id, endpoint_name, method, auth_type, status",Designed → Published → Active → Deprecated,"external_system_has_api: ExternalSystem cung cấp API APIEndpoint
api_generate..."
69,,,IntegrationEvent,"Event trao đổi giữa hệ thống: request sent, response received, error, retry.","integration_event_id, endpoint_id, event_type, payload_ref, status, timestamp",Created → Sent → Acknowledged/Failed,"api_generates_event: APIEndpoint phát sinh event IntegrationEvent
integration..."
